{"schema_version":1,"dataset":"synopsis_hub_diorama","adapter":"hub","trigger":"synopsis_hub_diorama","logical_grid":[480,270],"target_render":{"min_long_edge":1024,"scaling":"native_or_integer_nearest"},"generation_contract":{"images_per_job":1,"collage":false,"allow_flip":false,"allow_recolour_clone":false,"allow_smooth_upscale":false,"no_text":true,"no_ui":true},"enums":{"time_of_day":["dawn","day","golden_hour","civil_twilight","night"],"weather":["clear","overcast","rain","thunderstorm","snow","windy"],"season":["spring","summer","autumn","winter"],"split":["train","validation"]},"style_contract":{"pixel_scale":"fixed_logical_pixel_size","presentation":"nearest_neighbour","composition":"60/30/10","local_surface_shades":[3,5],"min_human_traces":3,"architecture":"compact practical one-to-two-storey scientific campus","forbidden":["giant ceremonial domes","palace colonnades","military styling","fantasy meteorology","mixed pixel scales","smooth antialiasing"]},"prompt_prefix":"Standalone single image, no frame, no text, no user interface, no collage. Original 26063 cozy scientific pixel-art language for a fictional educational and research meteorological campus of Northwestern Russia inspired by Petersburg scientific culture. Compose on a fixed logical 480x270 world grid: every logical pixel has one consistent display size, hard square pixel clusters, nearest-neighbour look, no anti-aliasing, no mixed pixel scales, no random single-pixel noise. Documentary plausibility, professional, cozy and lightly nostalgic rather than retro parody. Use the 60/30/10 composition rule: 60 percent calm large forms and breathing space, 30 percent functional architecture, instruments and vegetation, 10 percent accents. Use three to five shades per local material and include at least three believable human work traces when the scene allows. Meteorological maps and instruments remain scientifically precise and semantic weather colors must stay meaningful. For exterior views keep a low Northwestern horizon with Gulf-of-Finland character, granite, pine, birch and rowan where appropriate. No logos, signs or readable lettering.","negative_prompt":"collage, contact sheet, split screen, text, captions, logo, user interface, HUD, smooth vector edges, anti-aliasing, mixed pixel sizes, blur, random one-pixel noise, smooth gradients, 3D render, photorealism, giant ceremonial dome, palace, colonnade, monumental symmetry, military bunker, military base, fantasy, alpine mountains, cyberpunk, post-apocalypse, named-game imitation","scenes":{"map_pavilion":"Compact practical map pavilion with a modest glass lightwell, large physical synoptic maps on wall and tables, precise meteorological instruments, restrained scientific furniture, warm human work traces, no monumental architecture.","archive":"Meteorological archive and climatology room with shelves, folders, paper charts, climatology binders, catalog drawers, warm task lamps, and visible continuity between legacy paper practice and modern work.","aerology_balloon":"Practical low aerology building and launch yard with a radiosonde balloon, release equipment, wind sock and meteorological mast, compact service spaces, scientifically plausible equipment, no giant dome.","radar_hill":"Compact meteorological radar installation on a modest Baltic rise with a low practical service building, weather mast, granite access path and low Gulf horizon, professional civilian scientific character, no military styling.","tournament_hall":"Compact educational meteorology competition room with work tables, wall weather map, notebooks, instruments and traces of students and mentors working, functional rather than ceremonial, no interface text.","main_building_fountain":"Compact one-to-two-storey main campus building around a modest scientific courtyard water feature, granite terrace, practical entrances, warm windows and meteorological details, explicitly not a palace.","terraces_cat":"Granite terraces linking archive and service entrances, Baltic vegetation and warm windows, with Pascal the small fluffy ginger-white cat as a minor accent, plus ordinary work traces such as a mug, gloves or bicycle.","river_valley_bridge":"Low flat Northwestern landscape with a small river or stream, practical footbridge, observation path and discreet meteorological field traces, wet granite and Baltic vegetation as appropriate, no mountains.","full_diorama":"Whole compact research campus shown as a coherent cutaway diorama: interconnected one-to-two-storey buildings, visible working interiors, radar and masts, granite terraces, shoreline and vegetation, all under one unified lighting condition.","hero_workroom":"Compact operational workroom of the hero with desk, precise synoptic charts, monitor, notebooks, mug and backpack, practical lighting, modern and legacy meteorological tools, lived-in but professional, no readable text."},"samples":[{"id":"hub-map-pavilion-01","scene_id":"map_pavilion","lineage_id":"hub-src-001","split":"train","time_of_day":"dawn","weather":"clear","season":"spring","independent_render":true,"num_images":1,"min_long_edge":1024,"output_path":"datasets/lora/hub/source/hub-map-pavilion-01.png"},{"id":"hub-map-pavilion-02","scene_id":"map_pavilion","lineage_id":"hub-src-002","split":"train","time_of_day":"golden_hour","weather":"rain","season":"summer","independent_render":true,"num_images":1,"min_long_edge":1024,"output_path":"datasets/lora/hub/source/hub-map-pavilion-02.png"},{"id":"hub-map-pavilion-03","scene_id":"map_pavilion","lineage_id":"hub-src-003","split":"validation","time_of_day":"night","weather":"overcast","season":"autumn","independent_render":true,"num_images":1,"min_long_edge":1024,"output_path":"datasets/lora/hub/source/hub-map-pavilion-03.png"},{"id":"hub-archive-01","scene_id":"archive","lineage_id":"hub-src-004","split":"train","time_of_day":"night","weather":"clear","season":"autumn","independent_render":true,"num_images":1,"min_long_edge":1024,"output_path":"datasets/lora/hub/source/hub-archive-01.png"},{"id":"hub-archive-02","scene_id":"archive","lineage_id":"hub-src-005","split":"train","time_of_day":"golden_hour","weather":"rain","season":"spring","independent_render":true,"num_images":1,"min_long_edge":1024,"output_path":"datasets/lora/hub/source/hub-archive-02.png"},{"id":"hub-archive-03","scene_id":"archive","lineage_id":"hub-src-006","split":"validation","time_of_day":"day","weather":"overcast","season":"winter","independent_render":true,"num_images":1,"min_long_edge":1024,"output_path":"datasets/lora/hub/source/hub-archive-03.png"},{"id":"hub-aerology-balloon-01","scene_id":"aerology_balloon","lineage_id":"hub-src-007","split":"train","time_of_day":"dawn","weather":"clear","season":"spring","independent_render":true,"num_images":1,"min_long_edge":1024,"output_path":"datasets/lora/hub/source/hub-aerology-balloon-01.png"},{"id":"hub-aerology-balloon-02","scene_id":"aerology_balloon","lineage_id":"hub-src-008","split":"train","time_of_day":"day","weather":"windy","season":"autumn","independent_render":true,"num_images":1,"min_long_edge":1024,"output_path":"datasets/lora/hub/source/hub-aerology-balloon-02.png"},{"id":"hub-aerology-balloon-03","scene_id":"aerology_balloon","lineage_id":"hub-src-009","split":"validation","time_of_day":"civil_twilight","weather":"overcast","season":"winter","independent_render":true,"num_images":1,"min_long_edge":1024,"output_path":"datasets/lora/hub/source/hub-aerology-balloon-03.png"},{"id":"hub-radar-hill-01","scene_id":"radar_hill","lineage_id":"hub-src-010","split":"train","time_of_day":"day","weather":"clear","season":"summer","independent_render":true,"num_images":1,"min_long_edge":1024,"output_path":"datasets/lora/hub/source/hub-radar-hill-01.png"},{"id":"hub-radar-hill-02","scene_id":"radar_hill","lineage_id":"hub-src-011","split":"train","time_of_day":"day","weather":"snow","season":"winter","independent_render":true,"num_images":1,"min_long_edge":1024,"output_path":"datasets/lora/hub/source/hub-radar-hill-02.png"},{"id":"hub-radar-hill-03","scene_id":"radar_hill","lineage_id":"hub-src-012","split":"validation","time_of_day":"civil_twilight","weather":"thunderstorm","season":"summer","independent_render":true,"num_images":1,"min_long_edge":1024,"output_path":"datasets/lora/hub/source/hub-radar-hill-03.png"},{"id":"hub-tournament-hall-01","scene_id":"tournament_hall","lineage_id":"hub-src-013","split":"train","time_of_day":"golden_hour","weather":"clear","season":"autumn","independent_render":true,"num_images":1,"min_long_edge":1024,"output_path":"datasets/lora/hub/source/hub-tournament-hall-01.png"},{"id":"hub-tournament-hall-02","scene_id":"tournament_hall","lineage_id":"hub-src-014","split":"train","time_of_day":"night","weather":"rain","season":"autumn","independent_render":true,"num_images":1,"min_long_edge":1024,"output_path":"datasets/lora/hub/source/hub-tournament-hall-02.png"},{"id":"hub-tournament-hall-03","scene_id":"tournament_hall","lineage_id":"hub-src-015","split":"validation","time_of_day":"day","weather":"overcast","season":"spring","independent_render":true,"num_images":1,"min_long_edge":1024,"output_path":"datasets/lora/hub/source/hub-tournament-hall-03.png"},{"id":"hub-main-building-fountain-01","scene_id":"main_building_fountain","lineage_id":"hub-src-016","split":"train","time_of_day":"day","weather":"clear","season":"summer","independent_render":true,"num_images":1,"min_long_edge":1024,"output_path":"datasets/lora/hub/source/hub-main-building-fountain-01.png"},{"id":"hub-main-building-fountain-02","scene_id":"main_building_fountain","lineage_id":"hub-src-017","split":"train","time_of_day":"golden_hour","weather":"clear","season":"spring","independent_render":true,"num_images":1,"min_long_edge":1024,"output_path":"datasets/lora/hub/source/hub-main-building-fountain-02.png"},{"id":"hub-main-building-fountain-03","scene_id":"main_building_fountain","lineage_id":"hub-src-018","split":"validation","time_of_day":"civil_twi